[
  {
    "episode_id": "ep_a",
    "window_start": "2026-03-01T00:00:00.000Z",
    "window_end": "2026-03-11T23:59:59.999Z",
    "market_signature": {
      "interval": "1d",
      "return_1d": 0.041,
      "return_3d": 0.06,
      "return_7d": 0.09,
      "volatility_regime": "medium",
      "drawdown_pre": -0.03,
      "breakout": true,
      "volume_anomaly": true,
      "volume_anomaly_score": 1.95
    },
    "narrative_signature": {
      "topics": ["etf_institucional"],
      "entities": ["Bitcoin", "ETF"],
      "dominant_cause": "etf_institucional",
      "narrative_confidence": 0.7,
      "event_count": 2
    },
    "summary_local": "Episodio con breakout, aumento de volumen y narrativa ETF.",
    "outcome": {
      "forward_return_1d": 0.02,
      "forward_return_7d": 0.05,
      "forward_return_30d": 0.08,
      "forward_max_up": 0.1,
      "forward_max_down": -0.02,
      "continuation_or_reversion": "continuation"
    },
    "sources": ["market#a", "narrative#a"],
    "dataset_version": "episodes-v0-real",
    "trigger_type": "return",
    "trigger_strength": 1.24,
    "market_source_ref": "binance_klines__BTCUSDT__1d__market-v0-binance-1d.jsonl",
    "narrative_source_refs": ["gdelt#evt_a"],
    "status": "confirmed",
    "created_at": "2026-03-11T23:59:59.999Z"
  },
  {
    "episode_id": "ep_b",
    "window_start": "2026-03-02T00:00:00.000Z",
    "window_end": "2026-03-12T23:59:59.999Z",
    "market_signature": {
      "interval": "1d",
      "return_1d": 0.03,
      "return_3d": 0.05,
      "return_7d": 0.08,
      "volatility_regime": "high",
      "drawdown_pre": -0.04,
      "breakout": false,
      "volume_anomaly": false,
      "volume_anomaly_score": 1.3
    },
    "narrative_signature": {
      "topics": ["geopolitica"],
      "entities": ["Bitcoin", "United States"],
      "dominant_cause": "geopolitica",
      "narrative_confidence": 0.6,
      "event_count": 1
    },
    "summary_local": "Episodio con volatilidad alta y narrativa geopolitica.",
    "outcome": {
      "forward_return_1d": -0.01,
      "forward_return_7d": 0.03,
      "forward_return_30d": "insufficient_horizon",
      "forward_max_up": 0.04,
      "forward_max_down": -0.05,
      "continuation_or_reversion": "reversion"
    },
    "sources": ["market#b", "narrative#b"],
    "dataset_version": "episodes-v0-real",
    "trigger_type": "volatility_regime",
    "trigger_strength": 1.01,
    "market_source_ref": "binance_klines__BTCUSDT__1d__market-v0-binance-1d.jsonl",
    "narrative_source_refs": ["gdelt#evt_b"],
    "status": "confirmed",
    "created_at": "2026-03-12T23:59:59.999Z"
  }
]
